Current Price|Likes|Item|Title|Old Price|Discount|Brand|Link
350 грн|3|Люксовая успокаивающая сыворотка saint jane luxury beauty serum|Люксовая успокаивающая сыворотка saint jane luxury beauty serum||||https://shafa.ua/cosmetics/dlya-lica/sivorotki/97380384-lyuksovaya-uspokaivayushaya-syvorotka-saint-jane-luxury-beauty-serum
75 грн|5|Набор пробников продля окрашеных волос color wow: шампунь + кондиционер защита цвета|Набор пробников продля окрашеных волос color wow: шампунь + кондиционер защита цвета||||https://shafa.ua/cosmetics/dlya-volos/shampuni/93767541-nabor-probnikov-prodlya-okrashenyh-volos-color-wow-shampun
150 грн|14|База/праймер для макияжа urban decay all nighter face primer|База/праймер для макияжа urban decay all nighter face primer|175 грн|-15%|Urban Decay|https://shafa.ua/cosmetics/dekorativnaya/dlya-lica/baza-pod-makiyazh/49676030-bazapraymer-dlya-makiyazha-urban-decay-all-nighter-face-primer
270 грн|7|Сухой шампунь для волос living proof perfect hair day dry shampoo|Сухой шампунь для волос living proof perfect hair day dry shampoo|||Living Proof|https://shafa.ua/cosmetics/dlya-volos/shampuni/94787876-suhoy-shampun-dlya-volos-living-proof-perfect-hair-day-dry-shampoo
115 грн|30|Несмываемый кондиционер для волос ouai leave-in conditioner для идеальной гладкости волос|Несмываемый кондиционер для волос ouai leave-in conditioner для идеальной гладкости волос|140 грн|-18%||https://shafa.ua/cosmetics/dlya-volos/kondicionery/47065461-nesmyvaemyy-kondicioner-dlya-volos-ouai-leave-in-conditioner-dlya
90 грн|4|Очищающий гель для умывания fresh soy face cleanser, хит из сша|Очищающий гель для умывания fresh soy face cleanser, хит из сша|100 грн|-10%|Fresh|https://shafa.ua/cosmetics/dlya-lica/ochishcheniya-lica/93714883-ochishayushiy-gel-dlya-umyvaniya-fresh-soy-face-cleanser-hit-iz-ssha
240 грн|4|Солнцезащитная сыворотка для чувствительной кожи zitsticka megashade breakout-proof spf 50 serum|Солнцезащитная сыворотка для чувствительной кожи zitsticka megashade breakout-proof spf 50 serum||||https://shafa.ua/cosmetics/dlya-lica/sivorotki/95644538-solncezashitnaya-syvorotka-dlya-chuvstvitelnoy-kozhi-zitsticka
220 грн|6|Мини мужская парфюмированная вода yves saint laurent y|Мини мужская парфюмированная вода yves saint laurent y|||Yves Saint Laurent|https://shafa.ua/cosmetics/parfyumeriya/parfyumirovannaya-voda/93958973-mini-muzhskaya-parfyumirovannaya-voda-yves-saint-laurent-y
250 грн|38|Анти-эйдж крем для кожи вокруг глаз estee lauder advanced night repair eye|Анти-эйдж крем для кожи вокруг глаз estee lauder advanced night repair eye|||Estee Lauder|https://shafa.ua/cosmetics/dlya-lica/krem/60941997-anti-eydzh-krem-dlya-kozhi-vokrug-glaz-estee-lauder-advanced-night
100 грн|33|Уценка! солнцезащитный гель для лица lancome uv expert youth shield aqua gel spf50, 10 мл|Уценка! солнцезащитный гель для лица lancome uv expert youth shield aqua gel spf50, 10 мл|||Lancome|https://shafa.ua/cosmetics/dlya-lica/krem/62518667-solncezashitnyy-gel-lancome-uv-expert-youth-shield-aqua-gel-spf50
120 грн|28|Осветляющая сыворотка с ниацинамидом glow recipe niacinamide dew drops|Осветляющая сыворотка с ниацинамидом glow recipe niacinamide dew drops|135 грн|-12%||https://shafa.ua/cosmetics/dlya-lica/sivorotki/62523878-osvetlyayushaya-syvorotka-s-niacinamidom-glow-recipe-niacinamide-dew
250 грн|21|Набор люксовых пробников: nars, rare beauty, sephora, bareminerals, urban decay, too faced|Набор люксовых пробников: nars, rare beauty, sephora, bareminerals, urban decay, too faced|275 грн|-10%|Nars|https://shafa.ua/cosmetics/dekorativnaya/nabory/63647661-nabor-lyuksovyh-probnikov-nars-rare-beauty-sephora-bareminerals
140 грн|10|Масло для кутикулы с роликом the lyfestyle co 100% natural cuticle oil, сша|Масло для кутикулы с роликом the lyfestyle co 100% natural cuticle oil, сша|150 грн|-7%||https://shafa.ua/cosmetics/manikyur/uhod-i-lechenie/74289245-maslo-dlya-kutikuly-s-rolikom-the-lyfestyle-co-100-natural-cuticle
320 грн|19|Антивозрастной крем payot blue techni liss jour, 15 мл|Антивозрастной крем payot blue techni liss jour, 15 мл|||PAYOT|https://shafa.ua/cosmetics/dlya-lica/krem/78060151-antivozrastnoy-krem-payot-blue-techni-liss-jour-15-ml
200 грн|32|Карандаш для бровей anastasia beverly hills brow wiz|Карандаш для бровей anastasia beverly hills brow wiz|||Anastasia Beverly Hills|https://shafa.ua/cosmetics/dekorativnaya/dlya-brovej/karandashi/72963572-karandash-dlya-brovyay-anastasia-beverly-hills-brow-wiz
75 грн|5|Набор / палетка пробников тонального крема anastasia beverly hills luminous foundation|Набор / палетка пробников тонального крема anastasia beverly hills luminous foundation|||Anastasia Beverly Hills|https://shafa.ua/cosmetics/dekorativnaya/dlya-lica/tonalnyj-krem/64342277-nabor-paletka-probnikov-tonalnogo-krema-anastasia-beverly-hills
525 грн|4|Средство для умывания на основе угля glamglow supercleanse™ clearing cream-to-foam cleanser|Средство для умывания на основе угля glamglow supercleanse™ clearing cream-to-foam cleanser|550 грн|-5%|Glamglow|https://shafa.ua/cosmetics/dlya-lica/ochishcheniya-lica/76858429-sredstvo-dlya-umyvaniya-na-osnove-uglya-glamglow-supercleanse_
501 грн|25|Палетка хайлайтеров natasha denona glow gold shimmer duo, 14г|Палетка хайлайтеров natasha denona glow gold shimmer duo, 14г|540 грн|-8%|Natasha Denona|https://shafa.ua/cosmetics/dekorativnaya/dlya-lica/hajlajtery/61385568-paletka-haylayterov-natasha-denona-glow-gold-shimmer-duo-14g
200 грн|5|Супер-лёгкий увлажняющий крем tarte sea drink of h2o hydrating boost moisturizer|Супер-лёгкий увлажняющий крем tarte sea drink of h2o hydrating boost moisturizer|||Tarte|https://shafa.ua/cosmetics/dlya-lica/krem/69815384-super-lyogkiy-uvlazhnyayushiy-krem-tarte-sea-drink-of-h2o-hydrating
Бесплатно|9|Солнцезащионый крем la roche-posay spf50+ 3 мл|Солнцезащионый крем la roche-posay spf50+ 3 мл|||La Roche-Posay|https://shafa.ua/cosmetics/dlya-lica/krem/75882795-solncezashionyy-krem-la-roche-posay-50
345 грн|24|🥑 питательная маска для лица kiehl's avocado nourishing hydration mask🥑|🥑 питательная маска для лица kiehl's avocado nourishing hydration mask🥑|400 грн|-14%|Kiehl's|https://shafa.ua/cosmetics/dlya-lica/maski/69814680-pitatelnaya-maska-dlya-lica-kiehls-avocado-nourishing-hydration-mask
210 грн|17|Нюдовый блеск для губ anastasia beverly hills lip gloss|Нюдовый блеск для губ anastasia beverly hills lip gloss|||Anastasia Beverly Hills|https://shafa.ua/cosmetics/dekorativnaya/dlya-gub/blesk/84105636-nyudovyy-blesk-dlya-gub-anastasia-beverly-hills-lip-gloss
350 грн|7|Нюдовая матовая помада для губ sephora cream lip stain 23 copper blush|Нюдовая матовая помада для губ sephora cream lip stain 23 copper blush|||Sephora|https://shafa.ua/cosmetics/dekorativnaya/dlya-gub/pomada/84103384-nyudovaya-matovaya-pomada-dlya-gub-sephora-cream-lip-stain-23-copper
200 грн|4|Прозрачный гель для бровей sephora clear brow gel|Прозрачный гель для бровей sephora clear brow gel|||Sephora|https://shafa.ua/cosmetics/dekorativnaya/dlya-brovej/geli/72929680-prozrachnyy-gel-dlya-brovyay-sephora-clear-brow-gel
415 грн|19|Антивозрастная сыворотка для лица caudalie premier cru the serum|Антивозрастная сыворотка для лица caudalie premier cru the serum|440 грн|-6%|Caudalie|https://shafa.ua/cosmetics/dlya-lica/sivorotki/74215073-antivozrastnaya-syvorotka-dlya-lica-caudalie-premier-cru-the-serum
190 грн|17|Люкс! средство для глубокого очищения tatcha the deep cleanse exfoliating cleanser|Люкс! средство для глубокого очищения tatcha the deep cleanse exfoliating cleanser|200 грн|-5%|Tatcha|https://shafa.ua/cosmetics/dlya-lica/ochishcheniya-lica/75887540-ochishayushiy-gel-tatcha-the-deep-cleanse
165 грн|18|Крем / масло для гладкости волос alterna caviar anti-aging smoothing anti-frizz blowout|Крем / масло для гладкости волос alterna caviar anti-aging smoothing anti-frizz blowout|185 грн|-11%|Alterna|https://shafa.ua/cosmetics/dlya-volos/masla/54443565-krem-maslo-dlya-gladkosti-volos-alterna-caviar-anti-aging-smoothing
440 грн|10|Восстанавливающая маска для глаз avant brightening&depuffing hyaluronic overnight eye recovery mask за $93!|Восстанавливающая маска для глаз avant brightening&depuffing hyaluronic overnight eye recovery mask за $93!|||Avant|https://shafa.ua/cosmetics/dlya-lica/krem/71430553-vosstanavlivayushaya-maska-dlya-glaz-avant-brighteningdepuffing
360 грн|8|Скраб для губ becca hydra-light smoothing lip scrub|Скраб для губ becca hydra-light smoothing lip scrub|||Becca|https://shafa.ua/cosmetics/dekorativnaya/dlya-gub/balzamy/75885494-skrab-dlya-gub-becca-hydra-light-smoothing-lip-scrub
200 грн|8|Подкручивающая тушь benefit roller lash super-curling and lifting mascara|Подкручивающая тушь benefit roller lash super-curling and lifting mascara|||Benefit|https://shafa.ua/cosmetics/dekorativnaya/dlya-glaz/tush/83276252-podkruchivayushaya-tush-benefit-roller-lash-super-curling-and
80 грн|15|Пилинг салфетки с кислотами dr.dennis gross alpha beta peel extra strength formula|Пилинг салфетки с кислотами dr.dennis gross alpha beta peel extra strength formula|||Dr. Dennis Gross|https://shafa.ua/cosmetics/dlya-lica/maski/77683582-piling-salfetki-s-kislotami-drdennis-gross-alpha-beta-peel-extra
445 грн|14|Миниатюра jo malone london english pear & freesia, оригинал!|Миниатюра jo malone london english pear & freesia, оригинал!|470 грн|-6%|Jo Malone|https://shafa.ua/cosmetics/parfyumeriya/parfyumirovannaya-voda/76911948-miniatyura-jo-malone-london-english-pear-freesia-original
350 грн|2|Кисть для губ zoeva 330 с футляром, оригинал|Кисть для губ zoeva 330 с футляром, оригинал|||Zoeva|https://shafa.ua/cosmetics/aksessuary-dlya-krasoty/kisti/75675361-kist-dlya-gub-zoeva-330-s-futlyarom-original
500 грн|7|Сыворотка / крем для волос living proof perfect hair day 5-in-1 styling treatment, 118мл|Сыворотка / крем для волос living proof perfect hair day 5-in-1 styling treatment, 118мл|||Living Proof|https://shafa.ua/cosmetics/dlya-volos/masla/74923622-syvorotka-krem-dlya-volos-living-proof-perfect-hair-day-5-in-1
225 грн|14|Очищающая паста для волос christophe robin cleansing volumizing paste with pure rassoul clay & rose extracts|Очищающая паста для волос christophe robin cleansing volumizing paste with pure rassoul clay & rose extracts|250 грн|-10%|Christophe Robin|https://shafa.ua/cosmetics/dlya-volos/shampuni/72584326-ochishayushaya-pasta-dlya-volos-christophe-robin-cleansing
325 грн|8|Набор: норковые накладные ресницы с клеем lavaa lashes flirty lash set|Набор: норковые накладные ресницы с клеем lavaa lashes flirty lash set|350 грн|-8%||https://shafa.ua/cosmetics/dekorativnaya/dlya-glaz/nakladnye-resnicy/85547028-nabor-norkovye-nakladnye-resnicy-s-kleem-lavaa-lashes-flirty-lash
215 грн|21|Энзимный скраб для лица huda beauty / wishful yo glow enzyme scrub|Энзимный скраб для лица huda beauty / wishful yo glow enzyme scrub|||Huda Beauty|https://shafa.ua/cosmetics/dlya-lica/ochishcheniya-lica/70188482-enzimnyy-skrab-dlya-lica-huda-beauty-wishful-yo-glow-enzyme-scrub
165 грн|10|Сияющий солнцезащитный крем supergoop glow screen spf40 10 мл|Сияющий солнцезащитный крем supergoop glow screen spf40 10 мл|180 грн|-9%|Supergoop|https://shafa.ua/cosmetics/dlya-lica/krem/72854387-siyayushiy-solncezashitnyy-krem-supergoop-glow-screen-10-ml
80 грн|18|Набор пробников: giorgio armani luminous silk foundation тональный флюид с эффектом сияния|Набор пробников: giorgio armani luminous silk foundation тональный флюид с эффектом сияния|100 грн|-20%|Giorgio Armani|https://shafa.ua/cosmetics/dekorativnaya/dlya-lica/tonalnyj-krem/79048817-nabor-probnikov-giorgio-armani-luminous-silk-foundation-tonalnyy
501 грн|18|Отшелушивающая маска для лица glamglow youthmud glow stimulating treatment 30 мл|Отшелушивающая маска для лица glamglow youthmud glow stimulating treatment 30 мл|535 грн|-7%|Glamglow|https://shafa.ua/cosmetics/dlya-lica/maski/69988158-otshelushivayushaya-maska-dlya-lica-glamglow_youthmud-glow
160 грн|33|Глубоко увлажняющий крем-бальзам для губ fresh rose petal-soft deep hydration lip balm|Глубоко увлажняющий крем-бальзам для губ fresh rose petal-soft deep hydration lip balm|||Fresh|https://shafa.ua/cosmetics/dekorativnaya/dlya-gub/balzamy/47355012-gluboko-uvlazhnyayushiy-krem-balzam-dlya-gub-fresh-rose-petal-soft
85 грн|11|Праймер make up for ever step 1 primer hydra booster|Праймер make up for ever step 1 primer hydra booster||||https://shafa.ua/cosmetics/dekorativnaya/dlya-lica/baza-pod-makiyazh/83285479-praymer-make-up-for-ever-step-1-primer-hydra-booster
85 грн|29|Нишевый парфюм пробник maison martin margiela autumn vibes|Нишевый парфюм пробник maison martin margiela autumn vibes|||Maison Martin Margiela|https://shafa.ua/cosmetics/parfyumeriya/probniki/78551884-nishevyy-parfyum-probnik-maison-martin-margiela-autumn-vibes
130 грн|7|Стойкая матовая помада для губ sephora cream lip stain 14 blackberry sorbet 5 мл!|Стойкая матовая помада для губ sephora cream lip stain 14 blackberry sorbet 5 мл!|165 грн|-22%|Sephora|https://shafa.ua/cosmetics/dekorativnaya/dlya-gub/pomada/54863502-stoykaya-matovaya-pomada-dlya-gub-sephora-cream-lip-stain-14
450 грн|8|Палетка для макияжа лица thebalm alternative rock vol.1|Палетка для макияжа лица thebalm alternative rock vol.1|495 грн|-10%||https://shafa.ua/cosmetics/dekorativnaya/dlya-glaz/paletki/76859439-paletka-dlya-makiyazha-lica-thebalm-alternative-rock-vol1
85 грн|17|Набор шампунь и кондиционер moroccanoil moisture repair|Набор шампунь и кондиционер moroccanoil moisture repair|||Moroccanoil|https://shafa.ua/cosmetics/dlya-volos/shampuni/78071337-nabor-shampun-i-kondicioner-moroccanoil-moisture-repair
215 грн|12|Сыворотка для проблемной кожи с ретинолом shani darden skin care retinol reform|Сыворотка для проблемной кожи с ретинолом shani darden skin care retinol reform|220 грн|-3%||https://shafa.ua/cosmetics/dlya-lica/sivorotki/70939449-syvorotka-dlya-problemnoy-kozhi-s-retinolom-shani-darden-skin-care
80 грн|5|Косметичка ipsy из сша|Косметичка ipsy из сша||||https://shafa.ua/cosmetics/aksessuary-dlya-krasoty/kosmetichki/84102743-kosmetichka-ipsy-iz-ssha
30 грн|8|Пробник тонального крема huda beauty fauxfilter foundation|Пробник тонального крема huda beauty fauxfilter foundation|||Huda Beauty|https://shafa.ua/cosmetics/dekorativnaya/dlya-lica/tonalnyj-krem/77675201-probnik-tonalnogo-krema-huda-beauty-fauxfilter-foundation
180 грн|35|Увлажняющий гель для кожи вокруг глаз clinique moisture surge eye 96-hour hydro-filler|Увлажняющий гель для кожи вокруг глаз clinique moisture surge eye 96-hour hydro-filler|||Clinique|https://shafa.ua/cosmetics/dlya-lica/krem/59555608-uvlazhnyayushiy-gel-dlya-kozhi-vokrug-glaz-clinique-moisture-surge
365 грн|37|Сияющие жидкие тени natasha denona chroma crystal liquid eyeshadow mini set - disco & space, оригинал!|Сияющие жидкие тени natasha denona chroma crystal liquid eyeshadow mini set - disco & space, оригинал!|400 грн|-9%|Natasha Denona|https://shafa.ua/cosmetics/dekorativnaya/dlya-glaz/teni/71829911-siyayushie-zhidkie-teni-natasha-denona-chroma-crystal-liquid
70 грн|16|Косметичка ipsy двусторонняя, сша|Косметичка ipsy двусторонняя, сша|80 грн|-13%||https://shafa.ua/cosmetics/aksessuary-dlya-krasoty/kosmetichki/44543182-kosmetichka-ipsy-dvustoronnyaya-ssha
125 грн|20|Золотая косметичка sephora, сша|Золотая косметичка sephora, сша|139 грн|-11%|Sephora|https://shafa.ua/cosmetics/aksessuary-dlya-krasoty/kosmetichki/54441223-zolotaya-kosmetichka-sephora-ssha
90 грн|8|Золотые тени /однушка / рефил colourpop из линейки pressed powder shadow|Золотые тени /однушка / рефил  colourpop из линейки pressed powder shadow|100 грн|-10%||https://shafa.ua/cosmetics/dekorativnaya/dlya-glaz/teni/69819703-zolotye-teni-odnushka-refil-colourpop-iz-linyayki-pressed-powder
180 грн|7|Маска для восстановления волос с яблочным уксусом dphue acv apple cider vinegar hair masque|Маска для восстановления волос с яблочным уксусом dphue acv apple cider vinegar hair masque||||https://shafa.ua/cosmetics/dlya-volos/maski/70969018-maska-dlya-vosstanovleniya-volos-s-yablochnym-uksusom-dphue-acv
140 грн|23|Увлажняющий праймер с витаминами для сияния кожи smashbox photo finish vitamin glow primer|Увлажняющий праймер с витаминами для сияния кожи smashbox photo finish vitamin glow primer||||https://shafa.ua/cosmetics/dekorativnaya/dlya-lica/baza-pod-makiyazh/44947401-uvlazhnyayushiy-praymer-s-vitaminami-dlya-siyaniya-kozhi-smashbox
99 грн|23|Стойкая матовая помада для губ sephora cream lip stain|Стойкая матовая помада для губ sephora cream lip stain|115 грн|-14%|Sephora|https://shafa.ua/cosmetics/dekorativnaya/dlya-gub/pomada/47775323-stoykaya-matovaya-pomada-dlya-gub-sephora-cream-lip-stain
275 грн|30|Масло для лица с витамином с sunday riley c.e.o glow vitamin c + turmeric face oil|Масло для лица с витамином с sunday riley c.e.o glow vitamin c + turmeric face oil|300 грн|-9%|Sunday Riley|https://shafa.ua/cosmetics/dlya-lica/maslo/49674077-maslo-dlya-lica-s-vitaminom-s-sunday-riley-ceo-glow-vitamin-c
275 грн|21|Супер-стойкая матовая помада too faced melted matte liquified matte long wear lipstick|Супер-стойкая матовая помада too faced melted matte liquified matte long wear lipstick|295 грн|-7%|Too Faced|https://shafa.ua/cosmetics/dekorativnaya/dlya-gub/pomada/49676988-super-stoykaya-matovaya-pomada-too-faced-melted-matte-liquified
100 грн|17|Интенсивная увлажняющая, убирающая пушистость маска для волос living proof no frizz intense moisture mask|Интенсивная увлажняющая, убирающая пушистость маска для волос living proof no frizz intense moisture mask|110 грн|-10%|Living Proof|https://shafa.ua/cosmetics/dlya-volos/maski/68407710-intensivnaya-uvlazhnyayushaya-ubirayushaya-pushistost-maska-dlya
135 грн|24|Праймер / затирка для пор beautyblender the leveler™ pore minimizing primer|Праймер / затирка для пор beautyblender the leveler™ pore minimizing primer|150 грн|-10%|Beauty Blender|https://shafa.ua/cosmetics/dekorativnaya/dlya-lica/baza-pod-makiyazh/47068021-praymer-zatirka-dlya-por-beautyblender-the-leveler_-pore-minimizing
95 грн|18|Пробники консилер giorgio armani power fabric concealer|Пробники консилер giorgio armani power fabric concealer|100 грн|-5%|Giorgio Armani|https://shafa.ua/cosmetics/dekorativnaya/dlya-lica/konsilery/65117166-probniki-konsiler-giorgio-armani-power-fabric-concealer
250 грн|18|Антивозрастная сыворотка с витамином с sunday riley c.e.o. rapid flash brightening|Антивозрастная сыворотка с витамином с sunday riley c.e.o. rapid flash brightening|270 грн|-8%|Sunday Riley|https://shafa.ua/cosmetics/dlya-lica/sivorotki/53543150-antivozrastnaya-syvorotka-s-vitaminom-s-sunday-riley-ceo-rapid-flash
120 грн|6|Стайлер для волос bumble and bumble - bb. glow bond-building styler|Стайлер для волос bumble and bumble - bb. glow bond-building styler||||https://shafa.ua/cosmetics/dlya-volos/stajling/gel-dlya-fiksacii/65962204-stayler-dlya-volos-bumble-and-bumble-bb-glow-bond-building-styler
290 грн|10|Мультистик для глаз, губ и щек live tinted huestick live tinted huestick|Мультистик для глаз, губ и щек live tinted huestick live tinted huestick|300 грн|-4%||https://shafa.ua/cosmetics/dekorativnaya/dlya-glaz/teni/62453652-multistik-dlya-glaz-gub-i-shek-live-tinted-huestick-live-tinted
250 грн|14|Магнитная тушь benefit they're real! magnet mascara|Магнитная тушь benefit they're real! magnet mascara|||Benefit Cosmetics|https://shafa.ua/cosmetics/dekorativnaya/dlya-glaz/tush/64342024-magnitnaya-tush-benefit-theyre-real-magnet-mascara
275 грн|17|Карандаш помада /тени для глаз и губ fenty beauty frost metallic eye and lip crayon|Карандаш помада /тени для глаз и губ fenty beauty frost metallic eye and lip crayon|290 грн|-6%|Fenty Beauty by Rihanna|https://shafa.ua/cosmetics/dekorativnaya/dlya-gub/pomada/51726967-karandash-pomada-teni-dlya-glaz-i-gub-fenty-beauty-frost-metallic
380 грн|22|Универсальная банановая пудра ofra pressed banana powder, 10г, оригинал|Универсальная банановая пудра ofra pressed banana powder, 10г, оригинал|400 грн|-5%||https://shafa.ua/cosmetics/dekorativnaya/dlya-lica/pudra/60632780-universalnaya-bananovaya-pudra-ofra-pressed-banana-powder-10g
270 грн|11|Сухой шампунь для волос living proof perfect hair day dry shampoo, сша|Сухой шампунь для волос living proof perfect hair day dry shampoo, сша|||Living Proof|https://shafa.ua/cosmetics/dlya-volos/sprei/56434245-suhoy-shampun-dlya-volos-living-proof-perfect-hair-day-dry-shampoo
320 грн|25|Люкс! нюдовый блеск для губ pat mcgrath labs mini lust lip gloss|Люкс! нюдовый блеск для губ pat mcgrath labs mini lust lip gloss|||Pat McGrath Labs|https://shafa.ua/cosmetics/dekorativnaya/dlya-gub/blesk/65962978-lyuks-nyudovyy-blesk-dlya-gub-pat-mcgrath-labs-mini-lust-lip-gloss
325 грн|20|Супер сияющие тени / спаркл dose of colors block party eyeshadow, сша|Супер сияющие тени / спаркл dose of colors block party eyeshadow, сша|350 грн|-8%||https://shafa.ua/cosmetics/dekorativnaya/dlya-glaz/teni/59928247-super-siyayushie-teni-sparkl-dose-of-colors-block-party-eyeshadow
90 грн|13|Люкс! легендарный крем для лица charlotte tilbury magic cream moisturizer|Люкс! легендарный крем для лица charlotte tilbury magic cream moisturizer|||Charlotte Tilbury|https://shafa.ua/cosmetics/dlya-lica/krem/65964861-lyuks-legendarnyy-krem-dlya-lica-charlotte-tilbury-magic-cream
140 грн|22|Палетка ухаживающих помад для губ dior rouge ultra care liquid с кистью|Палетка ухаживающих помад для губ dior rouge ultra care liquid с кистью|150 грн|-7%|Christian Dior|https://shafa.ua/cosmetics/dekorativnaya/dlya-gub/pomada/50657478-paletka-uhazhivayushih-pomad-dlya-gub-dior-rouge-ultra-care-liquid-s
