Current Price|Likes|Item|Title|Old Price|Discount|Brand|Link
275 грн|6|Палетка румян для лица zoeva opulence blush palette|Палетка румян для лица zoeva opulence blush palette|295 грн|-7%||https://shafa.ua/cosmetics/dekorativnaya/dlya-lica/rumyana/64338406-paletka-rumyan-dlya-lica-zoeva-opulence-blush-palette
300 грн|36|Супер-ухаживающая бархатная матовая помада для губ clarins velvet lip perfector|Супер-ухаживающая бархатная матовая помада для губ clarins velvet lip perfector|330 грн|-10%|Clarins|https://shafa.ua/cosmetics/dekorativnaya/dlya-gub/pomada/68349060-super-uhazhivayushaya-barhainaya-matovaya-pomada-dlya-gub-clarins
260 грн|11|Кремовые тени revlon colorstay creme eye shadow|Кремовые тени revlon colorstay creme eye shadow|285 грн|-9%|Revlon Professional|https://shafa.ua/cosmetics/dekorativnaya/dlya-glaz/teni/64338091-kremovye-teni-revlon-colorstay-creme-eye-shadow
90 грн|15|Профессиональная 3-х ступенчатая система восстановления волос verb reset, сша|Профессиональная 3-х ступенчатая система восстановления волос verb reset, сша|100 грн|-10%||https://shafa.ua/cosmetics/dlya-volos/masla/54865912-professionalnaya-3-h-stupenchataya-sistema-vosstanovleniya-volos
250 грн|12|Мини карандаш для губ pat mcgrath permagel ultra lip pencil, оригинал!|Мини карандаш для губ pat mcgrath permagel ultra lip pencil, оригинал!|275 грн|-10%|Pat McGrath Labs|https://shafa.ua/cosmetics/dekorativnaya/dlya-gub/karandashi/64948825-mini-karandash-dlya-gub-pat-mcgrath-permagel-ultra-lip-pencil
215 грн|23|Антивозрастная сыворотка charlotte tilbury charlotte's magic serum crystal elixir 3.6мл|Антивозрастная сыворотка charlotte tilbury charlotte's magic serum crystal elixir 3.6мл|||Charlotte Tilbury|https://shafa.ua/cosmetics/dlya-lica/sivorotki/61543798-antivozrastnaya-syvorotka-charlotte-tilbury-charlottes-magic-serum
275 грн|17|Мини карандаш для губ pat mcgrath permagel ultra lip pencil suburbia|Мини карандаш для губ pat mcgrath permagel ultra lip pencil suburbia|||Pat McGrath Labs|https://shafa.ua/cosmetics/dekorativnaya/dlya-gub/karandashi/63761825-mini-karandash-dlya-gub-pat-mcgrath-permagel-ultra-lip-pencil
180 грн|9|Увлажняющий гель для кожи вокруг глаз clinique moisture surge eye 96-hour hydro-filler|Увлажняющий гель для кожи вокруг глаз clinique moisture surge eye 96-hour hydro-filler|||Clinique|https://shafa.ua/cosmetics/dlya-lica/krem/64953387-uvlazhnyayushiy-gel-dlya-kozhi-vokrug-glaz-clinique-moisture-surge
145 грн|18|Тушь для ресниц tarte sea surfer curl volumizing mascara|Тушь для ресниц tarte sea surfer curl volumizing mascara|160 грн|-10%|Tarte|https://shafa.ua/cosmetics/dekorativnaya/dlya-glaz/tush/58882704-tush-dlya-resnic-tarte-cosmetics-sea-surfer-curl-volumizing-mascara
275 грн|6|Парфюм спрей для дома bath&body works tis the season room spray|Парфюм спрей для дома bath&body works tis the season room spray|||Bath And Body Works|https://shafa.ua/cosmetics/parfyumeriya/sprei/62520570-parfyum-dlya-doma-bathbody-works-tis-the-season-room-spray
170 грн|14|Ночной антивозрастной крем для лица fresh lotus youth preserve dream night cream|Ночной антивозрастной крем для лица fresh lotus youth preserve dream night cream|180 грн|-6%|Fresh|https://shafa.ua/cosmetics/dlya-lica/krem/58846636-nochnoy-antivozrastnoy-krem-dlya-lica-fresh-lotus-youth-preserve
315 грн|8|Антивозрастная сыворотка для лица ren 10 мл|Антивозрастная сыворотка для лица ren 10 мл|350 грн|-10%||https://shafa.ua/cosmetics/dlya-lica/sivorotki/50750206-antieydzh-syvorotka-dlya-lica-ren-keep-young-and-beautiful-instant
90 грн|10|Сияющие золотые муссовые тени inmo velveteen dream shadow, сша|Сияющие золотые муссовые тени inmo velveteen dream shadow, сша|100 грн|-10%||https://shafa.ua/cosmetics/dekorativnaya/dlya-glaz/teni/51725155-siyayushie-zolotye-barhatnye-teni-inmo-velveteen-dream-shadow-ssha
235 грн|17|Миниатюра в спрее аромата clinique happy для женщин|Миниатюра в спрее аромата clinique happy для женщин|||Clinique|https://shafa.ua/cosmetics/parfyumeriya/parfyumirovannaya-voda/59551371-miniatyura-v-spree-aromata-clinique-happy-dlya-zhenshin
175 грн|16|Makeup eraser - многоразовая салфетка для снятия макияжа|Makeup eraser - многоразовая салфетка для снятия макияжа||||https://shafa.ua/cosmetics/dekorativnaya/dlya-snyatiya-makiyazha/58843284-makeup-eraser-mnogorazovaya-salfetka-dlya-snyatiya-makiyazha
